{"$id":"urn:lumi:lab:nml:request:v1","$schema":"https://json-schema.org/draft/2020-12/schema","additionalProperties":false,"properties":{"age":{"maximum":120,"minimum":4,"type":"integer"},"allowed_effects":{"items":{"enum":["knowledge_candidate","relationship_candidate","resource_candidate","obligation_candidate"],"type":"string"},"maxItems":4,"minItems":0,"type":"array","uniqueItems":true},"authorized_features":{"items":{"enum":["observation","cooperation","local_rules","consent","limited_resources","recorded_history","distinct_perspectives"],"type":"string"},"maxItems":7,"minItems":0,"type":"array","uniqueItems":true},"canon_fingerprint":{"pattern":"^[a-f0-9]{64}$","type":"string"},"count":{"maximum":5,"minimum":1,"type":"integer"},"families":{"items":{"enum":["epistemic","cooperation","ethical","resource","identity","legacy"],"type":"string"},"maxItems":6,"minItems":1,"type":"array","uniqueItems":true},"forbidden_risks":{"items":{"enum":["mild_peril","loss","ethical_conflict","identity_uncertainty"],"type":"string"},"maxItems":4,"minItems":0,"type":"array","uniqueItems":true},"max_per_family":{"maximum":5,"minimum":1,"type":"integer"},"max_per_source_group":{"maximum":5,"minimum":1,"type":"integer"},"min_families":{"maximum":5,"minimum":1,"type":"integer"},"min_source_groups":{"maximum":2,"minimum":1,"type":"integer"},"recent_ids":{"items":{"pattern":"^NM-[0-9]{3}$","type":"string"},"maxItems":20,"minItems":0,"type":"array","uniqueItems":true},"reveal_ceiling":{"maximum":2,"minimum":0,"type":"integer"},"schema":{"const":"nml.selection-request.v1"},"scope":{"const":"LAB_ONLY"},"seed":{"maxLength":100,"minLength":1,"type":"string"}},"required":["schema","scope","age","canon_fingerprint","seed","families","forbidden_risks","authorized_features","allowed_effects","reveal_ceiling","recent_ids","count","min_families","min_source_groups","max_per_family","max_per_source_group"],"type":"object"}
