{"age":10,"allowed_effects":["knowledge_candidate","relationship_candidate","resource_candidate","obligation_candidate"],"authorized_features":["observation","cooperation","local_rules","consent","limited_resources","recorded_history","distinct_perspectives"],"canon_fingerprint":"aaaaaaaaaaaaaaaaaaaaaaaaaaaaaaaaaaaaaaaaaaaaaaaaaaaaaaaaaaaaaaaa","count":3,"families":["epistemic","cooperation","ethical","resource","identity","legacy"],"forbidden_risks":["loss","identity_uncertainty"],"max_per_family":2,"max_per_source_group":2,"min_families":2,"min_source_groups":2,"recent_ids":[],"reveal_ceiling":1,"schema":"nml.selection-request.v1","scope":"LAB_ONLY","seed":"offline-demo-v1"}
